{
  "$schema": "http://json-schema.org/draft-07/schema#",
  "$id": "https://echo.app/schema/reflection-template.schema.json",
  "title": "ReflectionTemplate",
  "description": "One voice-tested reflection template. The library (T-ML-040, docs/04 \u00a7'The prose reflection') is the human-curated input to the M2 reflection pipeline (T-ML-042): the engine selects one or more templates whose `applies_when` block matches a trait vector, passes the chosen template (including voice notes + exemplars) to the LLM, then runs the output through the safety + tone classifiers. Changes to anything under /content/reflection-templates/ require human review per AGENTS.md \u00a710.6.",
  "type": "object",
  "required": [
    "id",
    "version",
    "applies_when",
    "voice_notes",
    "exemplars",
    "constraints"
  ],
  "additionalProperties": false,
  "properties": {
    "id": {
      "type": "string",
      "pattern": "^[a-z][a-z0-9-]*$",
      "description": "Stable identifier; must equal the basename of the file. Used by the audit log to identify which template fed each generated reflection."
    },
    "version": {
      "type": "integer",
      "minimum": 1,
      "description": "Bump when prose or selection criteria changes in a way that would alter outputs for existing trait vectors. The replay tool compares this to the stored value."
    },
    "summary": {
      "type": "string",
      "minLength": 1,
      "description": "One-line description of the profile this template addresses. Surfaced in the review queue UI."
    },
    "applies_when": {
      "type": "object",
      "additionalProperties": false,
      "required": ["any_of"],
      "description": "Selection criteria. Template is a candidate when the trait vector satisfies ANY of the signal groups (logical OR). Within a signal group, ALL predicates must hold (logical AND).",
      "properties": {
        "any_of": {
          "type": "array",
          "minItems": 1,
          "items": { "$ref": "#/$defs/signal" }
        }
      }
    },
    "priority": {
      "type": "integer",
      "default": 50,
      "minimum": 0,
      "maximum": 100,
      "description": "Higher = stronger candidate when multiple templates match. Single-dimension templates run at 50; contrast / multi-dimension templates run 60-80; meta + fallback templates run <30."
    },
    "voice_notes": {
      "type": "object",
      "additionalProperties": false,
      "required": ["emphasize", "avoid", "notes"],
      "properties": {
        "emphasize": {
          "type": "array",
          "minItems": 1,
          "uniqueItems": true,
          "items": {
            "type": "string",
            "enum": [
              "second_person",
              "specific_not_generic",
              "acknowledge_contradiction",
              "describe_not_evaluate",
              "no_archetype",
              "no_clinical_term",
              "sensory_detail",
              "small_image_close"
            ]
          },
          "description": "Voice rules to weight up in the LLM prompt for this profile. Drawn from docs/04 \u00a7'Voice rules'."
        },
        "avoid": {
          "type": "array",
          "minItems": 1,
          "uniqueItems": true,
          "items": { "type": "string", "minLength": 1 },
          "description": "Phrases or shorthands the LLM must not produce for this profile. Used by both the prompt assembler and the tone classifier."
        },
        "notes": {
          "type": "string",
          "minLength": 1,
          "description": "1-3 sentences of free-form voice direction. Surfaced to the LLM in the prompt and to human reviewers in the queue."
        }
      }
    },
    "exemplars": {
      "type": "array",
      "minItems": 1,
      "maxItems": 5,
      "description": "Hand-written sample outputs in the canonical voice. Used as few-shot examples in the LLM prompt and as regression anchors in tests.",
      "items": {
        "type": "object",
        "additionalProperties": false,
        "required": ["signal_moments", "output", "notes"],
        "properties": {
          "signal_moments": {
            "type": "array",
            "minItems": 1,
            "items": { "type": "string", "minLength": 1 },
            "description": "1-3 concrete in-game moments the exemplar grounds itself in. Each is a short phrase (\"the song you played alone\")."
          },
          "output": {
            "type": "string",
            "minLength": 1,
            "description": "The reflection text itself, 3-5 sentences in second person."
          },
          "notes": {
            "type": "string",
            "minLength": 1,
            "description": "What this exemplar is meant to demonstrate (e.g. 'reframes the curious-impulsive read as a single underlying decision style')."
          }
        }
      }
    },
    "constraints": {
      "type": "object",
      "additionalProperties": false,
      "required": ["voice", "min_sentences", "max_sentences"],
      "properties": {
        "voice": {
          "type": "string",
          "enum": ["second_person"],
          "description": "Only one voice is allowed today. Kept as an enum so future Echo personas (e.g. a B2B clinician variant) can extend safely."
        },
        "min_sentences": {
          "type": "integer",
          "minimum": 3,
          "maximum": 5
        },
        "max_sentences": {
          "type": "integer",
          "minimum": 3,
          "maximum": 5
        },
        "forbidden_terms": {
          "type": "array",
          "uniqueItems": true,
          "items": { "type": "string", "minLength": 1 },
          "description": "Terms the tone + safety classifiers must reject. Defaults defined in services/ml-py apply to every template; this list adds template-specific extras."
        }
      }
    }
  },
  "$defs": {
    "signal": {
      "type": "object",
      "additionalProperties": false,
      "required": ["all_of"],
      "description": "A conjunction of dimension predicates. Use a single-element all_of for one-dimension templates.",
      "properties": {
        "all_of": {
          "type": "array",
          "minItems": 1,
          "items": { "$ref": "#/$defs/predicate" }
        }
      }
    },
    "predicate": {
      "type": "object",
      "additionalProperties": false,
      "required": ["dimension", "direction", "min_magnitude"],
      "properties": {
        "dimension": {
          "type": "string",
          "enum": [
            "OCEAN-O",
            "OCEAN-C",
            "OCEAN-E",
            "OCEAN-A",
            "OCEAN-N",
            "SCH-SELF_DIRECTION",
            "SCH-STIMULATION",
            "SCH-HEDONISM",
            "SCH-ACHIEVEMENT",
            "SCH-POWER",
            "SCH-SECURITY",
            "SCH-CONFORMITY",
            "SCH-TRADITION",
            "SCH-BENEVOLENCE",
            "SCH-UNIVERSALISM",
            "ATT-SECURE",
            "ATT-ANXIOUS",
            "ATT-AVOIDANT"
          ]
        },
        "direction": {
          "type": "string",
          "enum": ["high", "low", "prominent", "muted"],
          "description": "How the predicate reads the dimension. For bipolar (Big Five, Schwartz) values in [-1, 1]: high = value >= min_magnitude; low = value <= -min_magnitude; prominent = |value| >= min_magnitude; muted = |value| < min_magnitude. Attachment values in [0, 1] only support high/prominent (>= min_magnitude) and low/muted (< min_magnitude)."
        },
        "min_magnitude": {
          "type": "number",
          "minimum": 0.05,
          "maximum": 1.0,
          "description": "Threshold for the predicate to fire. Conventional values: 0.3 (mild signal), 0.5 (clear signal), 0.7 (strong signal)."
        }
      }
    }
  }
}
